{"campgroundName":"pariatur est","campgroundId":"in commodo","parentName":"enim est sunt","parentId":"ea eu Duis laborum","agencyName":"USFS","operatedBy":"Concessionaire","managingAgency":"Lorem minim laboris","regionName":"consequat in esse","districtId":-15612011,"county":"ut","state":"eu","congressionalDistrict":"voluptate enim velit dolore in","timeZone":"sed laborum","daylightSavings":true,"latitude":"+1","longitude":"+180","mailingAddress":"esse dolor aliqua voluptate elit","phoneNumber":"culpa","emailAddress":"01NSmQ@KHVLdNrJyMPkPDVDiIhDNKNIjr.fj","currentStatus":"Temporarily Closed","currentConditions":"elit ex exercitation eu quis","reservations":"No","first-comeFirst-served":"No","seasonality":false,"seasonOpen":"1944-02-26","seasonClose":"1993-08-02","pets":"No","fires":"No","alcohol":true,"smoking":"No","fireworks":true,"firearms":"Yes with conditions","SUAS":"Yes with conditions","ageRequirement":true,"boats":"quis cillum cupidatat et","waterAccess":"Yes with conditions","horseFeed":"No","generators":"No","quietHours":"Yes with conditions","on-sitePersonnel":["No staff on site","Security","Facility Staff"],"seasonalStaffing":"Never","emergencyContact":"consequat est aute sunt","passesAccepted":"sunt","discountsAccepted":"cillum nostrud","paymentTypes":["Other","Digital fee machine","Campground host","Cash self-pay","Campground host"],"gateHours":"09:07:54.844Z","check-in":"20:06:11.111Z","check-out":"12:06:58.396Z","check-inLocation":"Lorem qui dolore nostrud tempor","check-outLocation":"cupidatat in anim","description":"dolore adipisicing consequat","aliases":"incididunt sed aute Ut dolor","drivingDirections":"Excepteur ex in","ORV":"No","relatedWebsites":"in sit sint id exercitation","map":"aliquip do elit eu","accessNotes":"in voluptate pariatur","nearestCity":"aliqua et non","physicalAddress":[],"locationDescription":"ipsum culpa","photos":["https://QKJ.eipfcysdtD4mPs8NlqA9iPKVtiK1W","http://UBqfHfeMlrGSxKeH.sjamlpdcIPEYAAvdw16CLZylrloGvYFxXXIlzUU0lv-gyY7vdnHCf","http://TfhxkdWYWAKpx.gzkelTV6kPQ5drRfQE+uwMVSAOohjFZMOJiJgwVCvETznWt"],"regionId":54507363,"logo":"https://EryoeErg.vyixItZJxqFmB1nv.0J+jL8OtQd","glassBottles":"No","elevation":-21007918.020446688,"foodStorage":"commodo sit cupidatat","seasonTypes":"Non-Peak","districtName":"sint consequat enim tempor"}